Section,ChatCHW asks,Reply,GraderBot rubric,Similarity
```
Question,What is the patient's age?,1,NA,NA
Question,Who is accompanying the patient?,1,NA,NA
Question,Please describe what brings you here today,Cough,NA,NA
Diagnosis,"Based on the information provided in the medical guide, a specific diagnosis cannot be determined without additional details about the patient's symptoms, the duration of the cough, and any accompanying signs such as chest indrawing or fast breathing.\n\n- Primary Diagnosis: Insufficient information to determine a primary diagnosis. The complaint of \cough\"" is too broad and could be associated with a range of conditions from a common cold to more serious illnesses like pneumonia", depending on additional symptoms and signs not provided in the patient information.\n\n- Differential Diagnoses: Possible differential diagnoses based on the guide could include a common cold, pneumonia (if chest indrawing or fast breathing were observed), tuberculosis, asthma, or whooping cough if the cough has persisted for 14 days or more. The exact condition would depend on further signs and symptoms not specified in the patient information.\n\n- Treatment Plan: Without specific details on the duration of the cough and the presence or absence of danger signs such as chest indrawing, fast breathing, or the cough lasting for 14 days or more, a definitive treatment plan cannot be recommended. If any danger signs are present, the guide advises urgent referral to a health facility for further assessment and treatment. If no danger signs are present, the condition might be managed in the community setting," but specific management steps cannot be provided without more information.""","No pneumonia (Simple cough/cold) – cough <14 days, normal breathing, no danger signs (p. 46).",0
Treatment,"ACTION PLAN:\n\n1. Ask the caregiver about the duration of the cough. If the cough has lasted for 14 days or more, proceed to the next step. If not, continue monitoring the patient.\n2. Check for any danger signs: cough for 14 days or more, diarrhea for 14 days or more, fast breathing, chest indrawing, unusually sleepy or unconscious.\n3. If the child has a cough for 14 days or more, refer to the possibility of tuberculosis (TB), asthma, whooping cough, or another problem that requires further assessment.\n4. Look for chest indrawing to identify severe pneumonia, especially in children with a cough or cold, or those having difficulty breathing.\n5. If any danger signs are present, including chest indrawing or a cough lasting for 14 days or more, refer the child URGENTLY to a health facility for further assessment and treatment.\n6. If no danger signs are present and the cough has not lasted for 14 days or more, continue to monitor the child in the community setting. Specific treatment recommendations cannot be provided without further information.\n\nNote: The medical guide does not provide specific treatment steps for managing a cough without danger signs in the community setting.","– No antibiotics needed (explain that without fast breathing, it’s likely a mild cough/cold) (p. 46). Advise home care: use a safe soothing remedy like a bit of honey in warm water to calm the cough (for child >6 months) (p. 46). Ensure the child continues feeding well and fluids. Warn against cough syrups or unsafe medicines (p. 46).",0
```
